{
  "meta": {
    "version": "phase3.2",
    "granularity": "month",
    "range": {
      "from": "2026-01",
      "to": "2027-12"
    }
  },
  "input": {
    "birth": {
      "date": "1999-02-26",
      "time": "14:00:00",
      "timezone": "UTC",
      "location": {
        "city": "Hyderabad",
        "region": "Telangana",
        "country": "India",
        "lat": 17.385,
        "lon": 78.4867
      }
    },
    "name": "Example Person"
  },
  "overview": {
    "headline": "Next period highlights day master strength with supporting emphasis.",
    "bullets": [
      "Top window 2026-01-01 to 2026-01-31 (supporting, intensity 0.55, confidence 0.80) themes: day_master_strength, element_earth, pillar_cycle.",
      "Most common theme across top windows: day_master_strength.",
      "Polarity balance: 6 supporting, 0 challenging, 0 neutral."
    ],
    "citations": [
      {
        "windowId": "cycle-d8caf09c5ed4",
        "themes": [
          "window:2026-01",
          "day_master_strength",
          "element_earth",
          "pillar_cycle"
        ],
        "systemsAligned": [
          "chinese",
          "vedic"
        ],
        "evidenceCycleIds": [
          "cycle-022fb49593e2",
          "cycle-2f1e6e67e9f7",
          "cycle-5847217bcbaa"
        ]
      },
      {
        "windowId": "cycle-52298f5223fe",
        "themes": [
          "window:2026-02",
          "day_master_strength",
          "element_earth",
          "pillar_cycle"
        ],
        "systemsAligned": [
          "chinese",
          "vedic"
        ],
        "evidenceCycleIds": [
          "cycle-022fb49593e2",
          "cycle-2f1e6e67e9f7"
        ]
      }
    ]
  },
  "windows": [
    {
      "windowId": "cycle-d8caf09c5ed4",
      "start": "2026-01-01",
      "end": "2026-01-31",
      "title": "Supportive window for day master strength",
      "paragraphs": [
        "From 2026-01-01 to 2026-01-31, this is a supporting period with intensity 0.55 and confidence 0.80.",
        "Primary focus: day master strength and element earth.",
        "Signals align across 2 systems (chinese and vedic)."
      ],
      "takeaways": [
        "Lean into day master strength actions; aim for steady execution.",
        "Prioritize decisions that compound over weeks, not days."
      ],
      "citations": [
        {
          "windowId": "cycle-d8caf09c5ed4",
          "themes": [
            "window:2026-01",
            "day_master_strength",
            "element_earth",
            "pillar_cycle"
          ],
          "systemsAligned": [
            "chinese",
            "vedic"
          ],
          "evidenceCycleIds": [
            "cycle-022fb49593e2",
            "cycle-2f1e6e67e9f7",
            "cycle-5847217bcbaa"
          ]
        }
      ]
    },
    {
      "windowId": "cycle-52298f5223fe",
      "start": "2026-02-01",
      "end": "2026-02-28",
      "title": "Supportive window for day master strength",
      "paragraphs": [
        "From 2026-02-01 to 2026-02-28, this is a supporting period with intensity 0.34 and confidence 0.80.",
        "Primary focus: day master strength and element earth.",
        "Signals align across 2 systems (chinese and vedic)."
      ],
      "takeaways": [
        "Lean into day master strength actions; aim for steady execution.",
        "Prioritize decisions that compound over weeks, not days."
      ],
      "citations": [
        {
          "windowId": "cycle-52298f5223fe",
          "themes": [
            "window:2026-02",
            "day_master_strength",
            "element_earth",
            "pillar_cycle"
          ],
          "systemsAligned": [
            "chinese",
            "vedic"
          ],
          "evidenceCycleIds": [
            "cycle-022fb49593e2",
            "cycle-2f1e6e67e9f7"
          ]
        }
      ]
    },
    {
      "windowId": "cycle-2f54cdee61cb",
      "start": "2026-03-01",
      "end": "2026-03-31",
      "title": "Supportive window for day master strength",
      "paragraphs": [
        "From 2026-03-01 to 2026-03-31, this is a supporting period with intensity 0.34 and confidence 0.80.",
        "Primary focus: day master strength and element earth.",
        "Signals align across 2 systems (chinese and vedic)."
      ],
      "takeaways": [
        "Lean into day master strength actions; aim for steady execution.",
        "Prioritize decisions that compound over weeks, not days."
      ],
      "citations": [
        {
          "windowId": "cycle-2f54cdee61cb",
          "themes": [
            "window:2026-03",
            "day_master_strength",
            "element_earth",
            "pillar_cycle"
          ],
          "systemsAligned": [
            "chinese",
            "vedic"
          ],
          "evidenceCycleIds": [
            "cycle-022fb49593e2",
            "cycle-2f1e6e67e9f7"
          ]
        }
      ]
    },
    {
      "windowId": "cycle-6b3c80d05bfa",
      "start": "2026-04-01",
      "end": "2026-04-30",
      "title": "Supportive window for day master strength",
      "paragraphs": [
        "From 2026-04-01 to 2026-04-30, this is a supporting period with intensity 0.34 and confidence 0.80.",
        "Primary focus: day master strength and element earth.",
        "Signals align across 2 systems (chinese and vedic)."
      ],
      "takeaways": [
        "Lean into day master strength actions; aim for steady execution.",
        "Prioritize decisions that compound over weeks, not days."
      ],
      "citations": [
        {
          "windowId": "cycle-6b3c80d05bfa",
          "themes": [
            "window:2026-04",
            "day_master_strength",
            "element_earth",
            "pillar_cycle"
          ],
          "systemsAligned": [
            "chinese",
            "vedic"
          ],
          "evidenceCycleIds": [
            "cycle-022fb49593e2",
            "cycle-2f1e6e67e9f7"
          ]
        }
      ]
    },
    {
      "windowId": "cycle-c18da2fe9061",
      "start": "2026-05-01",
      "end": "2026-05-31",
      "title": "Supportive window for day master strength",
      "paragraphs": [
        "From 2026-05-01 to 2026-05-31, this is a supporting period with intensity 0.34 and confidence 0.80.",
        "Primary focus: day master strength and element earth.",
        "Signals align across 2 systems (chinese and vedic)."
      ],
      "takeaways": [
        "Lean into day master strength actions; aim for steady execution.",
        "Prioritize decisions that compound over weeks, not days."
      ],
      "citations": [
        {
          "windowId": "cycle-c18da2fe9061",
          "themes": [
            "window:2026-05",
            "day_master_strength",
            "element_earth",
            "pillar_cycle"
          ],
          "systemsAligned": [
            "chinese",
            "vedic"
          ],
          "evidenceCycleIds": [
            "cycle-022fb49593e2",
            "cycle-2f1e6e67e9f7"
          ]
        }
      ]
    },
    {
      "windowId": "cycle-8e73ab415718",
      "start": "2026-06-01",
      "end": "2026-06-30",
      "title": "Supportive window for day master strength",
      "paragraphs": [
        "From 2026-06-01 to 2026-06-30, this is a supporting period with intensity 0.34 and confidence 0.80.",
        "Primary focus: day master strength and element earth.",
        "Signals align across 2 systems (chinese and vedic)."
      ],
      "takeaways": [
        "Lean into day master strength actions; aim for steady execution.",
        "Prioritize decisions that compound over weeks, not days."
      ],
      "citations": [
        {
          "windowId": "cycle-8e73ab415718",
          "themes": [
            "window:2026-06",
            "day_master_strength",
            "element_earth",
            "pillar_cycle"
          ],
          "systemsAligned": [
            "chinese",
            "vedic"
          ],
          "evidenceCycleIds": [
            "cycle-022fb49593e2",
            "cycle-2f1e6e67e9f7"
          ]
        }
      ]
    }
  ],
  "byDomain": {
    "career": {
      "headline": "No strong career windows in this range.",
      "bullets": [
        "No high-confidence windows in this domain.",
        "Monitor for emerging signals."
      ],
      "topWindows": []
    },
    "relationships": {
      "headline": "No strong relationships windows in this range.",
      "bullets": [
        "No high-confidence windows in this domain.",
        "Monitor for emerging signals."
      ],
      "topWindows": []
    },
    "growth": {
      "headline": "Key growth themes in this range",
      "bullets": [
        "2026-01-01 to 2026-01-31: supporting focus on day master strength.",
        "2026-02-01 to 2026-02-28: supporting focus on day master strength."
      ],
      "topWindows": [
        "cycle-d8caf09c5ed4",
        "cycle-52298f5223fe",
        "cycle-2f54cdee61cb"
      ]
    }
  },
  "style": {
    "tone": "neutral",
    "readingLevel": "plain"
  }
}
